{
  "schemaVersion": 1,
  "scope": "tokenization-sbd",
  "offsetUnits": "utf16-code-unit",
  "expectedOutputStatus": "recorded",
  "slices": [
    {
      "id": "empty-string",
      "purpose": "empty-input behavior",
      "source": {
        "kind": "text",
        "text": ""
      },
      "checks": [
        "empty-input",
        "repeated-run"
      ]
    },
    {
      "id": "ascii-two-sentences",
      "purpose": "basic Latin words and two sentence boundaries",
      "source": {
        "kind": "text",
        "text": "Hello world. This is text."
      },
      "checks": [
        "word-boundaries",
        "sentence-boundaries",
        "repeated-run"
      ]
    },
    {
      "id": "combining-mark",
      "purpose": "combining mark span accounting",
      "source": {
        "kind": "text",
        "text": "Café costs 5€."
      },
      "checks": [
        "unicode",
        "span-accounting"
      ]
    },
    {
      "id": "emoji-zwj",
      "purpose": "emoji and zero-width-joiner span accounting",
      "source": {
        "kind": "text",
        "text": "👩‍💻 wrote code. 🧪 passed."
      },
      "checks": [
        "unicode",
        "span-accounting",
        "sentence-boundaries"
      ]
    },
    {
      "id": "japanese-cjk",
      "purpose": "CJK punctuation and no-space script behavior",
      "source": {
        "kind": "text",
        "text": "私は学生です。よろしくお願いします。"
      },
      "checks": [
        "multilingual",
        "sentence-boundaries"
      ]
    },
    {
      "id": "arabic",
      "purpose": "right-to-left script with sentence punctuation",
      "source": {
        "kind": "text",
        "text": "مرحبا بالعالم. هذا نص."
      },
      "checks": [
        "multilingual",
        "word-boundaries",
        "sentence-boundaries"
      ]
    },
    {
      "id": "thai-no-space",
      "purpose": "no-space script input without claiming dictionary segmentation",
      "source": {
        "kind": "text",
        "text": "ภาษาไทยไม่มีเว้นวรรค"
      },
      "checks": [
        "multilingual",
        "documented-difference"
      ]
    },
    {
      "id": "unpaired-high-surrogate",
      "purpose": "malformed UTF-16 representation without lossy replacement",
      "source": {
        "kind": "utf16-code-units",
        "units": [
          "0061",
          "D800",
          "0062"
        ]
      },
      "checks": [
        "malformed-text",
        "span-accounting"
      ]
    },
    {
      "id": "abbreviation-ambiguity",
      "purpose": "sentence-boundary ambiguity around abbreviations",
      "source": {
        "kind": "text",
        "text": "Dr. Smith arrived at 3 p.m. He left."
      },
      "checks": [
        "sentence-boundaries",
        "documented-difference"
      ]
    },
    {
      "id": "newline-boundary",
      "purpose": "newline handling across sentence-boundary spans",
      "source": {
        "kind": "text",
        "text": "One line.\nNext line."
      },
      "checks": [
        "sentence-boundaries",
        "span-accounting"
      ]
    },
    {
      "id": "repeated-short-words",
      "purpose": "determinism on repeated short tokens",
      "source": {
        "kind": "text",
        "text": "ha ha ha. ha ha."
      },
      "checks": [
        "word-boundaries",
        "sentence-boundaries",
        "repeated-run"
      ]
    },
    {
      "id": "devanagari-hindi",
      "purpose": "Devanagari script with danda sentence punctuation",
      "source": {
        "kind": "text",
        "text": "नमस्ते दुनिया। यह पाठ है।"
      },
      "checks": [
        "multilingual",
        "word-boundaries",
        "sentence-boundaries",
        "span-accounting"
      ]
    },
    {
      "id": "hebrew-rtl",
      "purpose": "Hebrew right-to-left script with Latin-style sentence punctuation",
      "source": {
        "kind": "text",
        "text": "שלום עולם. זה טקסט."
      },
      "checks": [
        "multilingual",
        "right-to-left",
        "sentence-boundaries",
        "span-accounting"
      ]
    },
    {
      "id": "cyrillic-russian",
      "purpose": "Cyrillic script with space-delimited words and sentence punctuation",
      "source": {
        "kind": "text",
        "text": "Привет мир. Это текст."
      },
      "checks": [
        "multilingual",
        "word-boundaries",
        "sentence-boundaries",
        "span-accounting"
      ]
    },
    {
      "id": "greek",
      "purpose": "Greek script with accented letters and sentence punctuation",
      "source": {
        "kind": "text",
        "text": "Καλημέρα κόσμε. Δοκιμή."
      },
      "checks": [
        "multilingual",
        "word-boundaries",
        "sentence-boundaries",
        "span-accounting"
      ]
    },
    {
      "id": "ethiopic-amharic",
      "purpose": "Ethiopic script with Ethiopic sentence punctuation",
      "source": {
        "kind": "text",
        "text": "ሰላም ዓለም። ይህ ጽሑፍ ነው።"
      },
      "checks": [
        "multilingual",
        "word-boundaries",
        "sentence-boundaries",
        "span-accounting"
      ]
    },
    {
      "id": "korean-hangul",
      "purpose": "Hangul script with space-delimited words and sentence punctuation",
      "source": {
        "kind": "text",
        "text": "안녕하세요 세계. 테스트입니다."
      },
      "checks": [
        "multilingual",
        "word-boundaries",
        "sentence-boundaries",
        "span-accounting"
      ]
    },
    {
      "id": "armenian",
      "purpose": "Armenian script with Armenian sentence punctuation",
      "source": {
        "kind": "text",
        "text": "Բարև աշխարհ։ Սա տեքստ է։"
      },
      "checks": [
        "multilingual",
        "word-boundaries",
        "sentence-boundaries",
        "span-accounting"
      ]
    },
    {
      "id": "georgian",
      "purpose": "Georgian script with space-delimited words and sentence punctuation",
      "source": {
        "kind": "text",
        "text": "გამარჯობა მსოფლიო. ეს ტექსტია."
      },
      "checks": [
        "multilingual",
        "word-boundaries",
        "sentence-boundaries",
        "span-accounting"
      ]
    },
    {
      "id": "khmer",
      "purpose": "Khmer script with Khmer sentence punctuation",
      "source": {
        "kind": "text",
        "text": "សួស្តី ពិភពលោក។ នេះជាអត្ថបទ។"
      },
      "checks": [
        "multilingual",
        "word-boundaries",
        "sentence-boundaries",
        "span-accounting"
      ]
    }
  ]
}
